{
  "latencies": {
    "total": 37036760000,
    "mean": 12345587,
    "50th": 10234567,
    "90th": 19876543,
    "95th": 24567890,
    "99th": 38901234,
    "max": 98765432,
    "min": 503210
  },
  "bytes_in": {
    "total": 3072000,
    "mean": 1024.0
  },
  "bytes_out": {
    "total": 0,
    "mean": 0.0
  },
  "earliest": "2025-03-15T14:30:00.000000000Z",
  "latest": "2025-03-15T14:30:29.990000000Z",
  "end": "2025-03-15T14:30:30.098765432Z",
  "duration": 29990000000,
  "wait": 108765432,
  "requests": 3000,
  "rate": 100.03334,
  "throughput": 99.93334,
  "success": 0.9967,
  "status_codes": {
    "200": 2990,
    "500": 10
  },
  "errors": []
}
